"id","numero_expediente","titulo","tipo_expediente","fecha_inicio","vencimiento_cuatrienal","fecha_publicacion","numero_gaceta","numero_ley","creado_en"
"58","25434","DECLARATORIA DE BENEMERITAZGO DE LA PATRIA PARA VITHA LYNA FONSECA SABORÍO","PROCEDIMIENTO PROYECTOS DE COMISION DE HONORES","2026-03-09","2030-03-09","2026-04-06","61","","2026-04-10T05:14:48.326599"
"59","25433","ADICIÓN DE UN ARTÍCULO 33 TER DE LA LEY 7575, LEY FORESTAL Y SUS REFORMAS.","PROCEDIMIENTO PROYECTO DE LEY ORDINARIO","2026-03-09","2030-03-09","2026-04-06","61","","2026-04-10T05:14:48.326599"
"269","25223","AUTORIZACIÓN A LA REFINADORA COSTARRICENSE DE PETRÓLEO SOCIEDAD ANÓNIMA (RECOPE) PARA QUE DONE A FAVOR DEL MINISTERIO DE AMBIENTE Y ENERGÍA, DOS PROPIEDADES UBICADAS EN EL PARTIDO DE LIMÓN PARA CONSTRUIR LAS INSTALACIONES DE LA DIRECCIÓN REGIONAL DEL ÁREA DE CONSERVACIÓN LA AMISTAD CARIBE Y MEJORA DE LAS OFICINAS DE LA SUBREGIÓN LIMÓN-TALAMANCA.","PROCEDIMIENTO PROYECTO DE LEY ORDINARIO","2025-10-01","2029-10-01","2025-10-10","190","","2026-04-10T05:44:23.820827"
"270","25222","REFORMA AL ARTÍCULO 54 Y DEROGATORIA DE LOS ARTÍCULOS 55 Y 56 DE LA LEY N°30 CÓDIGO CIVIL DEL 19 DE ABRIL DE 1885 Y SUS REFORMAS. LEY PARA FACILITAR EL CAMBIO DE NOMBRE","PROCEDIMIENTO PROYECTO DE LEY ORDINARIO","2025-10-01","2029-10-01","2025-10-10","190","","2026-04-10T05:44:23.820827"
"271","25221","LEY PARA REFORMAR LOS ARTÍCULOS 174, 177 Y 178 Y ADICIONAR LOS ARTÍCULOS 174 BIS Y 177 BIS DEL CÓDIGO MUNICIPAL, N. º7794, DE 30 DE ABRIL DE 1998, PARA CREAR EL NOMBRAMIENTO DE MIEMBROS SUPLENTES DE LOS COMITÉS CANTONALES DE DEPORTES Y LIMITAR LA REELECCIÓN INDEFINIDA","PROCEDIMIENTO PROYECTO DE LEY ORDINARIO","2025-10-01","2029-10-01","2025-10-24","200","","2026-04-10T05:44:23.820827"
"272","25220","EXCLUSIÓN DEL FIDEICOMISO 1052- FONDO DE BIODIVERSIDAD SOSTENIBLE / BANCO NACIONAL DE COSTA RICA DE LA APLICACIÓN DE LA LEY N.°10495","PROCEDIMIENTO PROYECTO DE LEY ORDINARIO","2025-09-25","2029-09-25","2025-10-14","192","","2026-04-10T05:44:23.820827"
"273","25219","LEY QUE DECLARA DE INTERÉS NACIONAL EL ESTUDIO Y EXPLOTACIÓN DE LA ENERGÍA CINÉTICA, CON FINES DE PRODUCIR ELECTRICIDAD, EN EL GOLFO DE NICOYA","PROCEDIMIENTO PROYECTO DE LEY ORDINARIO","2025-09-25","2029-09-25","2025-10-08","188","","2026-04-10T05:44:23.820827"
"274","25218","TERCER PRESUPUESTO EXTRAORDINARIO DE LA REPÚBLICA PARA EL EJERCICIO ECONÓMICO 2025 Y TERCERA MODIFICACIÓN LEGISLATIVA DE LA LEY N°10.620, LEY DE PRESUPUESTO ORDINARIO Y EXTRAORDINARIO DE LA REPÚBLICA PARA EL EJERCICIO ECONÓMICO 2025, DEL 6 DE DICIEMBRE DE 2024.","PROCEDIMIENTO PRESUPUESTOS (ORDINARIOS, EXTRAORDINARIOS Y MODIFICACIONES)","2025-09-25","2029-09-25","2025-10-03","185","SI","2026-04-10T05:44:23.820827"
"275","25217","LEY PARA LA MODERNIZACIÓN DEL ESQUEMA TARIFARIO DEL SUMINISTRO DE ENERGÍA ELÉCTRICA","PROCEDIMIENTO PROYECTO DE LEY ORDINARIO","2025-09-24","2029-09-24","2025-10-08","188","","2026-04-10T05:44:23.820827"
"276","25216","IMPULSO A LAS ENERGÍAS RENOVABLES PARA EL DESARROLLO DEL MERCADO ELÉCTRICO NACIONAL","PROCEDIMIENTO PROYECTO DE LEY ORDINARIO","2025-09-24","2029-09-24","2025-10-08","188","","2026-04-10T05:44:23.820827"
"277","25215","REFORMA AL ARTÍCULO 28 DE LA LEY SISTEMA BANCA PARA EL DESARROLLO, LEY N.°8634 DE 23 DE ABRIL DE 2008 Y SUS REFORMAS","PROCEDIMIENTO PROYECTO DE LEY ORDINARIO","2025-09-24","2029-09-24","2025-10-08","188","","2026-04-10T05:44:23.820827"
"278","25214","REFORMA A LA LEY ORGÁNICA DE LA CONTRALORÍA GENERAL DE LA REPÚBLICA PARA ESTABLECER PLAZOS DE RESOLUCIÓN","PROCEDIMIENTO PROYECTO DE LEY ORDINARIO","2025-09-24","2029-09-24","2025-10-08","188","","2026-04-10T05:44:23.820827"
"279","25213","LEY PARA PROMOVER LA MEJORA REGULATORIA EN LOS GOBIERNOS LOCALES, REFORMA A LA LEY N.º 7794 CÓDIGO MUNICIPAL, DE 30 DE ABRIL DE 1998 Y SUS REFORMAS","PROCEDIMIENTO PROYECTO DE LEY ORDINARIO","2025-09-24","2029-09-24","2025-10-08","188","","2026-04-10T05:44:23.820827"
"280","25212","LEY PARA EL CONTROL PARLAMENTARIO DE LA DIRECCIÓN DE INTELIGENCIA Y SEGURIDAD NACIONAL, REFORMA A LA LEY GENERAL DE POLICÍA, N.º 7410, DE 26 DE MAYO DE 1994","PROCEDIMIENTO PROYECTO DE LEY ORDINARIO","2025-09-24","2029-09-24","2025-10-08","188","","2026-04-10T05:44:23.820827"
"281","25211","DECLARATORIA DE BENEMÉRITO DE LAS CIENCIAS, LAS ARTES Y LAS LETRAS PATRIAS AL PROFESOR Y LIDER COMUNAL WILLIAM RAMOS GÓMEZ","PROCEDIMIENTO PROYECTOS DE COMISION DE HONORES","2025-09-23","2029-09-23","2025-10-02","184","","2026-04-10T05:44:23.820827"
"282","25210","LEY DE DECLARATORIA DEL CENTRO CULTURAL COSTARRICENSE NORTEAMERICANO COMO INSTITUCIÓN BENEMÉRITA DE LA PATRIA","PROCEDIMIENTO PROYECTO DE LEY ORDINARIO","2025-09-23","2029-09-23","2025-10-14","192","","2026-04-10T05:44:23.820827"
"283","25209","ADICIÓN DE UN ARTÍCULO 55 BIS A LA LEY DE PROTECCIÓN AL TRABAJADOR, LEY N°7983, DE 16 DE FEBRERO DE 2000","PROCEDIMIENTO PROYECTO DE LEY ORDINARIO","2025-09-23","2029-09-23","2025-10-02","184","","2026-04-10T05:44:23.820827"
"284","25208","REFORMA DEL ARTÍCULO 174 DE LA LEY REGULADORA DEL MERCADO DE VALORES LEY N.º 7732 DE 17 DE DICIEMBRE DE 1997 Y SUS REFORMAS, REFORMA DE LOS ARTÍCULOS 16 BIS, 25, 69 BIS Y 72 Y ADICIÓN DE LOS ARTÍCULOS 16 TER Y 69 TER DE LA LEY SOBRE ESTUPEFACIENTES, SUSTANCIAS PSICOTRÓPICAS, DROGAS DE USO NO AUTORIZADO, ACTIVIDADES CONEXAS, LEGITIMACIÓN DE CAPITALES Y FINANCIAMIENTO AL TERRORISMO LEY N°7786, DEL 30 DE ABRIL DE 1998 Y SUS REFORMAS","PROCEDIMIENTO PROYECTO DE LEY ORDINARIO","2025-09-19","2029-09-19","2025-09-30","182","","2026-04-10T05:44:23.820827"
"285","25207","APROBACIÓN DEL PROTOCOLO QUE MODIFICA EL CONVENIO SOBRE LAS INFRACCIONES Y CIERTOS OTROS ACTOS COMETIDOS A BORDO DE LAS AERONAVES, LEY N° 5067 DEL 11 DE SEPTIEMBRE DE 1972","PROCEDIMIENTO PROYECTO DE LEY ORDINARIO","2025-09-19","2029-09-19","2025-10-08","188","","2026-04-10T05:44:23.820827"
"286","25206","LEY PARA FORTALECER LA PREVENCIÓN Y SANCIÓN DE ACTIVIDADES ILEGÍTIMAS RELACIONADAS CON EL ROBO DE COMBUSTIBLES Y DELITOS CONEXOS","PROCEDIMIENTO PROYECTO DE LEY ORDINARIO","2025-09-19","2029-09-19","2025-10-14","192","","2026-04-10T05:44:23.820827"
"287","25205","ADICIÓN DE UN NUEVO TRANSITORIO A LA LEY N°10.159 DEL 8 DE MARZO DE 2023. LEY PARA REDUCIR EL SALARIO DEL PRESIDENTE DE LA REPÚBLICA, LOS MINISTROS Y LOS VICEMINISTROS DE LA ADMINISTRACIÓN 2026-2030","PROCEDIMIENTO PROYECTO DE LEY ORDINARIO","2025-09-18","2029-09-18","2025-10-08","188","","2026-04-10T05:44:23.820827"
"288","25204","LEY PARA EL FORTALECIMIENTO DEL SISTEMA ANTILAVADO EN LA ACTIVIDAD GANADERA","PROCEDIMIENTO PROYECTO DE LEY ORDINARIO","2025-09-18","2029-09-18","2025-09-30","182","","2026-04-10T05:44:23.820827"
"289","25203","DECLARATORIA DE CIUDADANÍA HONORÍFICA PARA NORMAN HENRY WALCOTT","PROCEDIMIENTO PROYECTOS DE COMISION DE HONORES","2025-09-18","2029-09-18","2025-11-06","209","","2026-04-10T05:44:23.820827"
"290","25202","REFORMA DE VARIOS ARTÍCULOS DE LA LEY N.º 10.092 LEY DE REDUCCIÓN DE LA DEUDA PÚBLICA POR MEDIO DE LA VENTA DE ACTIVOS OCIOSOS O SUBUTILIZADOS DEL SECTOR PÚBLICO DEL 28 DE ENERO DE 2022: PARA GARANTIZAR SU EFECTIVA APLICACIÓN EN EL SECTOR PÚBLICO. ANTES DENIMINADO: REFORMA DE VARIOS ARTÍCULOS A LA LEY N.º 10.092 LEY DE REDUCCIÓN DE LA DEUDA PÚBLICA POR MEDIO DE LA VENTA DE ACTIVOS OCIOSOS O SUBUTILIZADOS DEL SECTOR PÚBLICO DEL 28 DE ENERO DE 2022: PARA GARANTIZAR SU EFECTIVA APLICACIÓN EN EL SECTOR PÚBLICO","PROCEDIMIENTO PROYECTO DE LEY ORDINARIO","2025-09-17","2029-09-17","2025-09-30","182","","2026-04-10T05:44:23.820827"
"60","25432","REFORMA A LOS ARTÍCULOS 84, 85 Y 86 DEL REGLAMENTO DE LA ASAMBLEA LEGISLATIVA","PROCEDIMIENTO REFORMAS AL REGLAMENTO DE LA ASAMBLEA LEGISLATIVA","2026-03-05","2030-03-05","2026-04-06","61","","2026-04-10T05:14:48.326599"
"61","25431","LEY PARA GARANTIZAR LA EJECUCIÓN EFECTIVA DEL FONDO DE DESARROLLO DE LA PROVINCIA DE LIMÓN (FODELI)","PROCEDIMIENTO PROYECTO DE LEY ORDINARIO","2026-03-05","2030-03-05","2026-04-06","61","","2026-04-10T05:14:48.326599"
"62","25430","LEY PARA LA IMPLEMENTACIÓN DE PARADAS INTELIGENTES CON ENERGÍA LIMPIA Y DATOS ABIERTOS","PROCEDIMIENTO PROYECTO DE LEY ORDINARIO","2026-03-05","2030-03-05","2026-04-06","61","","2026-04-10T05:14:48.326599"
"63","25429","LEY PARA LA INCLUSIÓN DE MÉTODOS ANTICONCEPTIVOS EN LA CANASTA BÁSICA TRIBUTARIA POR EL BIENESTAR INTEGRAL DE LAS FAMILIAS (CBTBIF)","PROCEDIMIENTO PROYECTO DE LEY ORDINARIO","2026-03-05","2030-03-05","2026-04-06","61","","2026-04-10T05:14:48.326599"
"64","25428","REFORMA A VARIOS INCISOS DEL ARTÍCULO 13, DEL CÓDIGO MUNICIPAL, LEY N°7794 DE 30 DE ABRIL DE 1998","PROCEDIMIENTO PROYECTO DE LEY ORDINARIO","2026-03-04","2030-03-04","2026-03-18","53","","2026-04-10T05:14:48.326599"
"65","25427","REFORMA AL ARTICULO 38 DE LA LEY ORGANICA DEL SISTEMA BANCARIO NACIONAL N° 1644 DEL 26 DE ENERO DE 1953. PARA REGULAR EL NOMBRAMIENTO DE LA ALTA GERENCIA","PROCEDIMIENTO PROYECTO DE LEY ORDINARIO","2026-03-04","2030-03-04","2026-04-06","61","","2026-04-10T05:14:48.326599"
"66","25426","LEY PARA LA RECUPERACIÓN AMBIENTAL, RESTAURACIÓN TERRITORIAL Y DESARROLLO SOSTENIBLE DE CRUCITAS","PROCEDIMIENTO PROYECTO DE LEY ORDINARIO","2026-03-04","2030-03-04","","","","2026-04-10T05:14:48.326599"
"1","25491","REFORMA DE LEY PARA EL FORTALECIMIENTO DEL RÉGIMEN SANCIONATORIO DEL CÓDIGO DE MINERÍA (LEY Nº 6797 DE 1982 Y SUS REFORMAS)","PROCEDIMIENTO PROYECTO DE LEY ORDINARIO","2026-04-09","2030-04-09","","","","2026-04-10T05:14:48.326599"
"2","25490","REFORMA DE LOS ARTÍCULOS 1, 9, 33 Y 95 INCISO 8, TODOS DE LA CONSTITUCIÓN POLÍTICA, PARA ELEVAR A RANGO CONSTITUCIONAL EL PRINCIPIO DE PARIDAD DE GÉNERO","PROCEDIMIENTO REFS PARS CONSTITUCION POLITICA, PROVINCIAS Y MAGISTRADOS","2026-04-09","2030-04-09","","","","2026-04-10T05:14:48.326599"
"3","25489","LEY PARA GARANTIZAR LA OPERATIVIDAD INMEDIATA DE LOS FONDOS DE EMERGENCIA SANITARIA AGROPECUARIA","PROCEDIMIENTO PROYECTO DE LEY ORDINARIO","2026-04-09","2030-04-09","","","","2026-04-10T05:14:48.326599"
"4","25488","REFORMA DE LEY PARA FORTALECER LA GOBERNANZA Y PROFESIONALIZACION DE LA JUNTA DIRECTIVA DE LA CAJA COSTARRICENSE DE SEGURO SOCIAL (CCSS)","PROCEDIMIENTO PROYECTO DE LEY ORDINARIO","2026-04-09","2030-04-09","","","","2026-04-10T05:14:48.326599"
"67","25425","LEY PARA ERRADICAR EL TRÁFICO ILÍCITO DE COMBUSTIBLE PARA EL APROVISIONAMIENTO DE EMBARCACIONES DEDICADAS AL CRIMEN ORGANIZADO (REFORMA A LAS LEYES 9096, 7557 Y 8754)","PROCEDIMIENTO PROYECTO DE LEY ORDINARIO","2026-03-04","2030-03-04","2026-03-18","53","","2026-04-10T05:14:48.326599"
"68","25424","LEY PARA LA PROTECCIÓN DEL DESARROLLO ECONÓMICO Y SOCIAL DE LA ZONA SUR DE LA PROVINCIA DE PUNTARENAS","PROCEDIMIENTO PROYECTO DE LEY ORDINARIO","2026-03-03","2030-03-03","2026-03-12","49","","2026-04-10T05:14:48.326599"
"69","25423","FORTALECIMIENTO DEL FINANCIAMIENTO DE ASOCIACIONES DE CUIDADOS PALIATIVOS DE MENOR TAMAÑO. MODIFICACIÓN DEL ARTÍCULO 14 DE LA LEY N°8718, DEL 18 DE FEBRERO DEL 2009. AUTORIZACIÓN PARA EL CAMBIO DE NOMBRE DE LA JUNTA DE PROTECCIÓN SOCIAL Y ESTABLECIMIENTO DE LA DISTRIBUCIÓN DE RENTAS DE LAS LOTERÍAS NACIONALES.","PROCEDIMIENTO PROYECTO DE LEY ORDINARIO","2026-03-03","2030-03-03","2026-03-12","49","","2026-04-10T05:14:48.326599"
"70","25422","APROBACIÓN DEL CONTRATO DE PRÉSTAMO Nº 9834-CR PRIMER PRÉSTAMO DE POLÍTICA DE DESARROLLO PARA LA GESTIÓN FISCAL Y EL CRECIMIENTO VERDE DE COSTA RICA SUSCRITO ENTRE LA REPÚBLICA DE COSTA RICA Y EL BANCO INTERNACIONAL DE RECONSTRUCCIÓN Y FOMENTO (BIRF)","PROCEDIMIENTO PROYECTO DE LEY ORDINARIO","2026-03-03","2030-03-03","2026-04-06","61","","2026-04-10T05:14:48.326599"
"71","25421","REFORMA CONSTITUCIONAL PARA FORTALECER EL PRINCIPIO DEMOCRÁTICO EN LA ELECCIÓN DEL PRESIDENTE Y VICEPRESIDENTE DE LA REPÚBLICA, MODIFICACIÓN DEL ARTÍCULO 132 DE LA CONSTITUCIÓN POLÍTICA.","PROCEDIMIENTO REFS PARS CONSTITUCION POLITICA, PROVINCIAS Y MAGISTRADOS","2026-02-26","2030-02-26","2026-03-12","49","","2026-04-10T05:14:48.326599"
"72","25420","LEY DE PROTECCIÓN MARÍTIMA","PROCEDIMIENTO PROYECTO DE LEY ORDINARIO","2026-02-26","2030-02-26","2026-03-12","49","","2026-04-10T05:14:48.326599"
"73","25419","LEY DE EQUIDAD TERRITORIAL Y COMPENSACIÓN MUNICIPAL POR EMPLAZAMIENTO DE INFRAESTRUCTURA PENITENCIARIA","PROCEDIMIENTO PROYECTO DE LEY ORDINARIO","2026-02-26","2030-02-26","2026-03-12","49","","2026-04-10T05:14:48.326599"
"74","25418","REFORMA A LOS ARTÍCULOS 121 INCISO 15, 176 Y 177 DE LA CONSTITUCIÓN POLÍTICA","PROCEDIMIENTO REFS PARS CONSTITUCION POLITICA, PROVINCIAS Y MAGISTRADOS","2026-02-25","2030-02-25","2026-03-12","49","","2026-04-10T05:14:48.326599"
"75","25417","LEY PARA EL FORTALECIMIENTO Y LA SOSTENIBILIDAD FINANCIERA DE LA CRUZ ROJA COSTARRICENSE MEDIANTE LA REFORMA A LA DISTRIBUCIÓN DE LAS PRIMAS DE SEGUROS","PROCEDIMIENTO PROYECTO DE LEY ORDINARIO","2026-02-25","2030-02-25","2026-03-12","49","","2026-04-10T05:14:48.326599"
"76","25416","LEY PARA LA REGULARIZACIÓN, INDEMNIZACIÓN Y BLINDAJE JURÍDICO DE LAS TIERRAS INCORPORADAS AL PATRIMONIO NATURAL DEL ESTADO Y ÁREAS SILVESTRES PROTEGIDAS","PROCEDIMIENTO PROYECTO DE LEY ORDINARIO","2026-02-24","2030-02-24","2026-03-04","43","","2026-04-10T05:14:48.326599"
"77","25415","REFORMA DEL REGLAMENTO INTERNO DE LA ASAMBLEA LEGISLATIVA PARA PROMOVER EL AVANCE DE LOS PROYECTOS DE LEY","PROCEDIMIENTO REFORMAS AL REGLAMENTO DE LA ASAMBLEA LEGISLATIVA","2026-02-24","2030-02-24","2026-03-04","43","","2026-04-10T05:14:48.326599"
"78","25414","PERMISO PARA EL ATRAQUE, PERMANENCIA EN EL PUERTO DE LIMÓN Y DESEMBARQUE DE LA TRIPULACION DEL ""JUAN SEBASTIÁN DE ELCANO"" BUQUE NO ARTILLADO DE LA ESCUELA DE LA ARMADA ESPAÑOLA, EL CUAL ESTARÁ EN PUERTO DURANTE EL PERIODO QUE COMPRENDE DEL 16 AL 23 DE ABRIL DE 2026.","PROCEDIMIENTO SOLICITUDES DE ATRAQUE Y DESEMBARQUE","2026-02-24","2030-02-24","","","","2026-04-10T05:14:48.326599"
"79","25413","INVESTIGACIÓN SOBRE LA AMPLIACIÓN DEL TRAMO BARRANCA-LIMONAL Y LAS IRREGULARIDADES SUCEDIDAS CON LA EMPRESA TRADECO","PROCEDIMIENTO COMISIONES ESPECIALES INVESTIGADORAS","2026-02-12","2030-02-12","","","","2026-04-10T05:14:48.326599"
"80","25412","LEY PARA EXCLUIR LA INVERSIÓN EN EDUCACIÓN PÚBLICA DE LA APLICACIÓN DE LA REGLA FISCAL","PROCEDIMIENTO PROYECTO DE LEY ORDINARIO","2026-02-19","2030-02-19","2026-03-04","43","","2026-04-10T05:14:48.326599"
"81","25411","LEY PARA GARANTIZAR LA RESOLUCIÓN OPORTUNA DE VETOS MUNICIPALES: REFORMA AL ARTÍCULO 167 DEL CÓDIGO MUNICIPAL LEY N.º 7794 DEL 30 DE ABRIL DE 1998","PROCEDIMIENTO PROYECTO DE LEY ORDINARIO","2026-02-18","2030-02-18","2026-03-04","43","","2026-04-10T05:14:48.326599"
"82","25410","DEROGATORIA AL ARTICULO 195 DEL CÓDIGO MUNICIPAL, LEY N.º 7794 DEL 30 DE ABRIL DE 1998 Y SUS REFORMAS.","PROCEDIMIENTO PROYECTO DE LEY ORDINARIO","2026-02-18","2030-02-18","2026-03-04","43","","2026-04-10T05:14:48.326599"
"83","25409","AUTORIZACIÓN AL ESTADO PARA QUE DESAFECTE Y DONE A LA ASOCIACIÓN DE DESARROLLO INTEGRAL DE SAN ISIDRO DE AGUAS CLARAS UPALA, UN BIEN INMUEBLE DE SU PROPIEDAD. ANTES DENOMINADO: LEY PARA AUTORIZAR AL ESTADO PARA QUE DESAFECTE Y DONE A LA ASOCIACIÓN DE DESARROLLO INTEGRAL DE SAN ISIDRO DE AGUAS CLARAS UPALA, UN BIEN INMUEBLE DE SU PROPIEDAD","PROCEDIMIENTO PROYECTO DE LEY ORDINARIO","2026-02-17","2030-02-17","2026-03-04","43","","2026-04-10T05:14:48.326599"
"84","25408","LEY PARA LA PROMOCIÓN DE TECNOLOGÍAS DIGITALES EMERGENTES PARA EL DESARROLLO","PROCEDIMIENTO PROYECTO DE LEY ORDINARIO","2026-02-16","2030-02-16","2026-03-04","43","","2026-04-10T05:14:48.326599"
"85","25407","DECLARACIÓN DE CIUDADANA DISTINGUIDA A MARILYN ECHEVERRÍA ZÜRCHER","PROCEDIMIENTO PROYECTOS DE COMISION DE HONORES","2026-02-16","2030-02-16","2026-03-04","43","","2026-04-10T05:14:48.326599"
"86","25406","REFORMA AL ARTÍCULO 1 DE LA LEY N.°9510, AUTORIZACIÓN A LA MUNICIPALIDAD DEL CANTÓN DE OSA PARA QUE SEGREGUE INMUEBLE DE SU PROPIEDAD Y LOS DONE A LAS PERSONAS DE ESCASOS RECURSOS Y PARCELEROS AGRÍCOLAS","PROCEDIMIENTO PROYECTO DE LEY ORDINARIO","2026-02-16","2030-02-16","2026-03-04","43","","2026-04-10T05:14:48.326599"
"87","25405","LEY ARIEL: AUTONOMÍA, RECONOCIMIENTO E INCLUSIÓN DE PERSONAS CON DISCAPACIDAD INTELECTUAL EN EL ENTORNO LABORAL","PROCEDIMIENTO PROYECTO DE LEY ORDINARIO","2026-02-13","2030-02-13","2026-03-04","43","","2026-04-10T05:14:48.326599"
"1388","24540","ADICIÓN DE UN INCISO I) Y UN INCISO J) AL ARTÍCULO 2 DE LA LEY GENERAL DE CONTRATACIÓN PÚBLICA, LEY N.º 9986, DE 27 DE MAYO DE 2021, Y SUS REFORMAS","PROCEDIMIENTO PROYECTO DE LEY ORDINARIO","2024-09-04","2028-09-04","2024-09-25","178","","2026-04-14T05:17:28.435099"
"1389","24539","AUTORIZACIÓN AL INSTITUTO MIXTO DE AYUDA SOCIAL PARA QUE DESAFECTE, SEGREGUE Y DONE UN TERRENO DE SU PROPIEDAD A LA ASOCIACIÓN PRO-VIVIENDA CALLE LA ESTEFANA. (ANTERIORMENTE DENOMINADO: LEY DE AUTORIZACIÓN AL INSTITUTO MIXTO DE AYUDA SOCIAL PARA QUE DESAFECTE, SEGREGUE Y DONE UN TERRENO DE SU PROPIEDAD A LA ASOCIACIÓN PRO-VIVIENDA CALLE LA ESTEFANA).","PROCEDIMIENTO PROYECTO DE LEY ORDINARIO","2024-09-04","2028-09-04","2024-09-25","178","SI","2026-04-14T05:17:28.435099"
"1390","24538","LEY PARA LA GESTIÓN MUNICIPAL DE ACERAS Y SISTEMAS URBANOS DE DRENAJE Y SANEAMIENTO, REFORMA LOS ARTÍCULOS 83, 83 BIS Y 84 INCISO D, DEL CÓDIGO MUNICIPAL","PROCEDIMIENTO PROYECTO DE LEY ORDINARIO","2024-09-03","2028-09-03","2024-09-25","178","","2026-04-14T05:17:28.435099"
"1391","24537","REFORMA DEL ARTÍCULO 131 DE LA LEY 4179, LEY DE ASOCIACIONES COOPERATIVAS, DE 22 DE AGOSTO DE 1968, PARA INCORPORAR EL INSTITUTO JURÍDICO DEL ACTO COOPERATIVO. INICIALMENTE DENOMINADO: REFORMA AL ARTÍCULO 131 DE LA LEY DE ASOCIACIONES COOPERATIVAS, PARA INCORPORAR EL INSTITUTO JURÍDICO DEL ACTO COOPERATIVO","PROCEDIMIENTO PROYECTO DE LEY ORDINARIO","2024-09-03","2028-09-03","2024-09-24","177","SI","2026-04-14T05:42:04.212357"
"1392","24536","AUTORIZACIÓN A LA MUNICIPALIDAD DE TALAMANCA PARA QUE DONE UN TERRENO DE SU PROPIEDAD AL INSTITUTO NACIONAL DE APRENDIZAJE (INA). (ANTERIORMENTE DENOMINADO: ""LEY QUE AUTORIZA A LA MUNICIPALIDAD DE TALAMANCA A DONAR UN TERRENO DE SU PROPIEDAD AL INSTITUTO NACIONAL DE APRENDIZAJE"")","PROCEDIMIENTO PROYECTO DE LEY ORDINARIO","2024-09-02","2028-09-02","2024-09-24","177","SI","2026-04-14T05:42:04.212357"
"1393","24535","LEY DE PRESUPUESTO ORDINARIO Y EXTRAORDINARIO DE LA REPÚBLICA PARA EL EJERCICIO ECONÓMICO 2025","PROCEDIMIENTO PRESUPUESTOS (ORDINARIOS, EXTRAORDINARIOS Y MODIFICACIONES)","2024-08-30","2028-08-30","2024-09-16","171","SI","2026-04-14T05:42:04.212357"
"1394","24534","SE INVESTIGUE EXHAUSTIVAMENTE TODO LO RELACIONADO CON LOS CONTRATOS, LICITACIONES, ADJUDICACIONES Y COMPRAS PÚBLICAS, QUE PODRÍAN GENERAR IRREGULARIDADES EN LA EMPRESA RACSA","PROCEDIMIENTO COMISIONES ESPECIALES INVESTIGADORAS","2024-08-22","2028-08-22","","","","2026-04-14T05:42:04.212357"
"1395","24533","REFORMA DE LOS TRANSITORIOS I Y X DE LA LEY 8904, REFORMA DEL SEGUNDO PÁRRAFO Y ADICIÓN DE VARIOS PÁRRAFOS AL ARTÍCULO 8; ADICIÓN DEL ARTÍCULO 8 BIS; ADICIÓN DEL INCISO F) AL ARTÍCULO 65, Y REFORMA DEL INCISO K) DEL ARTÍCULO 103 DEL CÓDIGO DE MINERÍA, LEY N.° 6797, DE 4 DE OCTUBRE DE 1982, Y SUS REFORMAS, LEY PARA DECLARAR A COSTA RICA PAÍS LIBRE DE MINERÍA METÁLICA A CIELO ABIERTO, DE 1 DE DICIEMBRE DE 2010.","PROCEDIMIENTO PROYECTO DE LEY ORDINARIO","2024-08-28","2028-08-28","2024-09-23","176","","2026-04-14T05:42:04.212357"
"1396","24532","DESAFECTACIÓN DEL USO PÚBLICO DE UN BIEN PROPIEDAD DEL BENEMÉRITO CUERPO DE BOMBEROS DE COSTA RICA Y AUTORIZACIÓN PARA SU DONACIÓN A LA CORTE SUPREMA DE JUSTICIA, PARA USO DEL ORGANISMO DE INVESTIGACIÓN JUDICIAL. ANTES DENOMINADO: DESAFECTACIÓN DEL USO PÚBLICO DE UN BIEN PROPIEDAD DEL BENEMÉRITO CUERPO DE BOMBEROS DE COSTA RICA Y AUTORIZACIÓN PARA SU DONACIÓN A LA CORTE SUPREMA DE JUSTICIA PARA USO DEL ORGANISMO DE INVESTIGACIÓN JUDICIAL","PROCEDIMIENTO PROYECTO DE LEY ORDINARIO","2024-08-28","2028-08-28","2024-09-13","170","","2026-04-14T05:42:04.212357"
"1397","24531","DECLARACIÓN DE INTERÉS PÚBLICO PARA EL DESARROLLO TURÍSTICO Y EL VALOR HISTÓRICO DE LOS DISTRITOS DE POROZAL Y BEBEDERO DEL CANTÓN DE CAÑAS","PROCEDIMIENTO PROYECTO DE LEY ORDINARIO","2024-08-28","2028-08-28","2024-09-13","170","SI","2026-04-14T05:42:04.212357"
"1398","24530","LEY PARA LA CREACIÓN DE LOS CENTROS ESPECIALIZADOS DE ATENCIÓN Y ALBERGUE TEMPORAL PARA MUJERES EN VIOLENCIA DOMÉSTICA Y RIESGO DE MUERTE EN COSTA RICA","PROCEDIMIENTO PROYECTO DE LEY ORDINARIO","2024-08-28","2028-08-28","2024-09-13","170","","2026-04-14T05:42:04.212357"
"1399","24529","LEY PARA LA PREVENCIÓN, LUCHA CONTRA LA CRIMINALIDAD Y EL NARCOTRÁFICO: REFORMA DE LA LEY ORGÁNICA DEL MINISTERIO DE SEGURIDAD PÚBLICA N°5482, LA LEY GENERAL DE POLICÍA N°7410, Y EL CÓDIGO MUNICIPAL LEY N°7794 PARA EL FORTALECIMIENTO DE LA SEGURIDAD PÚBLICA","PROCEDIMIENTO PROYECTO DE LEY ORDINARIO","2024-08-27","2028-08-27","2024-09-13","170","","2026-04-14T05:42:04.212357"
"1400","24528","DECLARATORIA DE INTERÉS PÚBLICO E INCLUSIÓN DE UN PLAN DE SALUD MENTAL EN EL SISTEMA EDUCATIVO COSTARRICENSE","PROCEDIMIENTO PROYECTO DE LEY ORDINARIO","2024-08-27","2028-08-27","2024-09-10","167","SI","2026-04-14T05:42:04.212357"
"1401","24527","REFORMA PARCIAL DE LA LEY N°4179, LEY DE ASOCIACIONES COOPERATIVAS Y CREACION DEL INFOCOOP DEL 22 DE AGOSTO DE 1968 Y SUS REFORMAS, PARA LA CONSTITUCIÓN E INSCRIPCIÓN DE COOPERATIVAS","PROCEDIMIENTO PROYECTO DE LEY ORDINARIO","2024-08-27","2028-08-27","2024-09-13","170","","2026-04-14T05:42:04.212357"
"1402","24526","REFORMA DEL ARTÍCULO 20 Y ADICIÓN DEL ARTÍCULO 20 BIS Y DEL ARTÍCULO 21 BIS A LA LEY 8039, LEY DE PROCEDIMIENTOS DE OBSERVANCIA DE LOS DERECHOS DE PROPIEDAD INTELECTUAL, DE 12 DE OCTUBRE DE 2000. ANTES DENOMINADO: MODIFICACIÓN DEL ARTÍCULO 20 Y ADICION DEL ARTÍCULO 20 BIS Y DEL ARTÍCULO 21 BIS A LA LEY DE PROCEDIMIENTOS DE OBSERVANCIA DE LOS DERECHOS DE PROPIEDAD INTELECTUAL N.º 8039 Y SUS REFORMAS.","PROCEDIMIENTO PROYECTO DE LEY ORDINARIO","2024-08-27","2028-08-27","2024-09-16","171","SI","2026-04-14T05:42:04.212357"
"1403","24525","LEY DE REINVINDICACIÓN DEL TRABAJADOR INDEPENDIENTE MEDIANTE LA REFORMA AL ARTÍCULO 3 DE LA LEY N°17 LEY CONSTITUTIVA DE LA CAJA COSTARRICENSE DE SEGURO SOCIAL CCSS Y AL ARTÍCULO 15 DE LA LEY N°7092 LEY DEL IMPUESTO SOBRE LA RENTA","PROCEDIMIENTO PROYECTO DE LEY ORDINARIO","2024-08-27","2028-08-27","2024-09-10","167","","2026-04-14T05:42:04.212357"
"1404","24524","LEY DE INCLUSIÓN, FORTALECIMIENTO Y DESARROLLO INTEGRAL DE LA PERSONA ADULTA MAYOR Y PERSONA CON DISCAPACIDAD. REFORMA A LA LEY 7794, CÓDIGO MUNICIPAL, DE 30 DE ABRIL DE 1998","PROCEDIMIENTO PROYECTO DE LEY ORDINARIO","2024-08-27","2028-08-27","2024-09-16","171","","2026-04-14T05:42:04.212357"
"1405","24523","REFORMA DEL ARTÍCULO 20 DE LA LEY CONTRA LA DELINCUENCIA ORGANIZADA, LEY N.°8754, DE 24 DE JULIO DE 2009 Y SUS REFORMAS","PROCEDIMIENTO PROYECTO DE LEY ORDINARIO","2024-08-27","2028-08-27","2024-09-16","171","","2026-04-14T05:42:04.212357"
"1406","24522","DECLARACIÓN DE BENEMERITAZGO DE LA PATRIA AL INSTITUTO NACIONAL DE SEGUROS, INS","PROCEDIMIENTO PROYECTO DE LEY ORDINARIO","2024-08-26","2028-08-26","2024-09-10","167","","2026-04-14T05:42:04.212357"
"1407","24521","LEY PARA QUE SE MODIFIQUE EL ARTICULO 52, DE LA LEY N.º 8131, LEY DE LA ADMINISTRACIÓN FINANCIERA DE LA REPÚBLICA Y PRESUPUESTOS PÚBLICOS","PROCEDIMIENTO PROYECTO DE LEY ORDINARIO","2024-08-26","2028-08-26","2024-09-10","167","","2026-04-14T05:42:04.212357"
"1408","24520","LEY PARA AUMENTAL EL PRESUPUESTO QUE INVIERTE EL ESTADO EN LA ATENCIÓN DE LA SALUD MENTAL","PROCEDIMIENTO PROYECTO DE LEY ORDINARIO","2024-08-22","2028-08-22","2024-09-10","167","","2026-04-14T05:42:04.212357"
"1409","24519","REFORMA Y ADICIÓN DE VARIOS ARTÍCULOS A LA LEY N°10204, LEY PROTECTORA DE LA ACTIVIDAD DEL BOYEO Y LA CARRETA COSTARRICENSE, DE 5 DE MAYO DE 2022","PROCEDIMIENTO PROYECTO DE LEY ORDINARIO","2024-08-22","2028-08-22","2024-09-06","165","","2026-04-14T05:42:04.212357"
"1410","24518","LEY QUE DOTA DE MAYOR FINANCIAMIENTO LA SEGURIDAD PUBLICA","PROCEDIMIENTO PROYECTO DE LEY ORDINARIO","2024-08-22","2028-08-22","2024-09-04","163","","2026-04-14T05:42:04.212357"
"1411","24517","PRESCRIPCION DE OFICIO PARA DEUDAS FINANCIERAS EN COBRO JUDICIAL","PROCEDIMIENTO PROYECTO DE LEY ORDINARIO","2024-08-22","2028-08-22","2024-09-06","165","","2026-04-14T05:42:04.212357"
"1412","24516","ADICIÓN DE UN ARTÍCULO 214 TER AL CÓDIGO PENAL, LEY N°4573 DEL 04 DE MAYO DE 1970, EXTORSIÓN SEXUAL","PROCEDIMIENTO PROYECTO DE LEY ORDINARIO","2024-08-22","2028-08-22","2024-09-04","163","","2026-04-14T05:42:04.212357"
"1413","24515","LEY PARA EXCEPTUAR DE LA APLICACIÓN DE LA REGLA FISCAL AL PODER JUDICIAL","PROCEDIMIENTO PROYECTO DE LEY ORDINARIO","2024-08-22","2028-08-22","2024-09-16","171","","2026-04-14T05:42:04.212357"
"1414","24514","INVESTIGACIÓN SOBRE TODOS LOS PERMISOS OTORGADOS POR CUALQUIER ENTE ESTATAL A LAS PROPIEDADES UBICADAS DENTRO O CERCANAS AL REFUGIO NACIONAL DE VIDA SILVESTRE GANDOCA-MANZANILLO, LAS RELACIONES DE CASA PRESIDENCIAL Y LA MUNICIPALIDAD DE TALAMANCA CON LOS PROPIETARIOS, INCLUYENDO LAS INACCIONES O NEGLIGENCIAS DERIVADAS DE ÓRDENES JUDICIALES AL ESTADO PARA RECUPERAR PROPIEDADES QUE SON PARTE DEL PATRIMONIO DEL ESTADO Y QUE DE MANERA IRREGULAR FUERON TRASPASADAS A PROPIETARIOS PRIVADOS","PROCEDIMIENTO COMISIONES ESPECIALES INVESTIGADORAS","2024-08-13","2028-08-13","","","","2026-04-14T05:42:04.212357"
"1415","24513","LEY DE CREACIÓN DEL DEPÓSITO LIBRE COMERCIAL DE LA PROVINCIA DE LIMÓN","PROCEDIMIENTO PROYECTO DE LEY ORDINARIO","2024-08-21","2028-08-21","2024-09-04","163","","2026-04-14T05:42:04.212357"
