"id","numero_expediente","titulo","tipo_expediente","fecha_inicio","vencimiento_cuatrienal","fecha_publicacion","numero_gaceta","numero_ley","creado_en"
"567","25035","LEY QUE SANCIONA LA VIOLACIÓN DE COMUNICACIONES DE LOS CUERPOS POLICIALES Y DE EMERGENCIAS DEL PAÍS","PROCEDIMIENTO PROYECTO DE LEY ORDINARIO","2025-06-05","2029-06-05","2025-06-18","111","","2026-04-10T15:33:40.043913"
"568","25034","MODIFICACIÓN DEL ARTÍCULO 18 DE LA LEY ORGÁNICA DEL AMBIENTE, LEY NÚMERO 7554 DEL 04 DE OCTUBRE DE 1995 Y SUS REFORMAS. LEY PARA GARANTIZAR LA IMPARCIALIDAD EN LAS EVALUACIONES DE IMPACTO AMBIENTAL.","PROCEDIMIENTO PROYECTO DE LEY ORDINARIO","2025-06-05","2029-06-05","2025-06-18","111","","2026-04-10T15:33:40.043913"
"569","25033","LEY DE SEGURO AMBIENTAL","PROCEDIMIENTO PROYECTO DE LEY ORDINARIO","2025-06-05","2029-06-05","2025-06-18","111","","2026-04-10T15:33:40.043913"
"570","25032","ADICIÓN DE UN ARTÍCULO NUEVO A LA LEY ORGÁNICA DEL AMBIENTEL, N°7554 DEL 04 DE OCTUBRE DE 1995 Y SUS REFORMAS","PROCEDIMIENTO PROYECTO DE LEY ORDINARIO","2025-06-05","2029-06-05","2025-06-18","111","","2026-04-10T15:33:40.043913"
"571","25031","REFORMA A LA LEY N°10.008 LEY PARA ATRAER TRABAJADORES Y PRESTADORES REMOTOS DE SERVICIOS DE CARÁCTER INTERNACIONAL (NÓMADAS DIGITALES), DE 11 DE AGOSTO DE 2021 PARA EL FORTALECIMIENTO Y COORDINACIÓN DEL TURISMO RURAL COMUNITARIO Y DEL RÉGIMEN DE NÓMADAS DIGITALES.","PROCEDIMIENTO PROYECTO DE LEY ORDINARIO","2025-06-05","2029-06-05","2025-06-18","111","","2026-04-10T15:33:40.043913"
"572","25030","ADICIÓN DE UN PÁRRAFO FINAL AL ARTÍCULO 30 DE LA LEY N° 6043 LEY SOBRE LA ZONA MARÍTIMO TERRESTRE DE 2 DE MARZO DE 1977 Y SUS REFORMAS. LEY PARA LA PROMOCIÓN DE LA TRANSPARENCIA DE LAS CONCESIONES EN ZONA MARÍTIMO TERRESTRE","PROCEDIMIENTO PROYECTO DE LEY ORDINARIO","2025-06-05","2029-06-05","2025-06-18","111","","2026-04-10T15:33:40.043913"
"573","25029","REFORMA AL ARTÍCULO 17 DE LA LEY N°4240 LEY DE PLANIFICACIÓN URBANA DEL 15 DE NOVIEMBRE DE 1968 Y SUS REFORMAS. LEY PARA GARANTIZAR LA PARTICIPACIÓN CIUDADANA EN LOS PLANES DE ORDENAMIENTO TERRITORIAL.","PROCEDIMIENTO PROYECTO DE LEY ORDINARIO","2025-06-05","2029-06-05","2025-06-18","111","","2026-04-10T15:33:40.043913"
"574","25028","LEY PARA LA GOBERNANZA MARINA DEMOCRÁTICA EN COSTA RICA","PROCEDIMIENTO PROYECTO DE LEY ORDINARIO","2025-06-05","2029-06-05","2025-06-18","111","","2026-04-10T15:33:40.043913"
"575","25027","AMNISTÍA PARA EL ORDENAMIENTO DE POZOS NO INSCRITOS Y OTORGAMIENTO DE CONCESIONES PARA EL APROVECHAMIENTO DEL RECURSO HÍDRICO PARA CONSUMO HUMANO","PROCEDIMIENTO PROYECTO DE LEY ORDINARIO","2025-06-04","2029-06-04","2025-06-18","111","","2026-04-10T15:33:40.043913"
"576","25026","REFORMA AL ARTÍCULO 265 BIS DE LA LEY GENERAL DE ADUANAS, N.° 7557 DE 20 DE OCTUBRE DE 1995","PROCEDIMIENTO PROYECTO DE LEY ORDINARIO","2025-06-04","2029-06-04","2025-06-18","111","","2026-04-10T15:33:40.043913"
"577","25025","INFORME ANUAL DE LABORES DE LA DEFENSORÍA DE LOS HABITANTES CORRESPONDIENTE AL PERÍODO 2024-2025, EN CUMPLIMIENTO CON EL ARTÍCULO 15 DE LA LEY DE LA DEFENSORÍA DE LOS HABITANTES, N° 7319 Y SUS REFORMAS","PROCEDIMIENTO COMISIONES AD-HOC","2025-06-04","2029-06-04","","","","2026-04-10T15:33:40.043913"
"578","25024","APROBACIÓN DE LA ADHESIÓN DE COSTA RICA AL CONVENIO SOBRE LA PROTECCIÓN Y UTILIZACIÓN DE LOS CURSOS DE AGUAS TRANSFRONTERIZAS Y DE LOS LAGOS INTERNACIONALES","PROCEDIMIENTO PROYECTO DE LEY ORDINARIO","2025-06-03","2029-06-03","2025-06-11","106","","2026-04-10T15:33:40.043913"
"579","25023","LEY PARA COMBATIR EL INCUMPLIMIENTO DE MEDIDAS DE PROTECCIÓN A FAVOR DE LAS MUJERES","PROCEDIMIENTO PROYECTO DE LEY ORDINARIO","2025-06-03","2029-06-03","2025-06-11","106","","2026-04-10T15:33:40.043913"
"580","25022","ADICIÓN DE UN INCISO C) AL TRANSITORIO XI DE LA LEY MARCO DE EMPLEO PÚBLICO, LEY N°10.159, DE 8 DE MARZO DE 2022 Y SUS REFORMAS","PROCEDIMIENTO PROYECTO DE LEY ORDINARIO","2025-06-03","2029-06-03","2025-06-23","114","","2026-04-10T15:33:40.043913"
"581","25021","LEY PARA LA CONDONACIÓN TOTAL DE DEUDAS DE TITULACIÓN DE TERRENOS ANTE EL INDER PARA LOS PROPIETARIOS DEL ASENTAMIENTO CAMPESINO EL COCAL, SIQUIRRES","PROCEDIMIENTO PROYECTO DE LEY ORDINARIO","2025-06-02","2029-06-02","2025-06-23","114","","2026-04-10T15:33:40.043913"
"582","25020","LEY PARA PROMOVER LA INNOVACIÓN TECNOLÓGICA EN EL SISTEMA DE BANCA PARA EL DESARROLLO","PROCEDIMIENTO PROYECTO DE LEY ORDINARIO","2025-06-02","2029-06-02","2025-06-11","106","","2026-04-10T15:33:40.043913"
"583","25019","LEY PARA LA SIMPLIFICACIÓN DEL CÁLCULO DE LA BASE IMPONIBLE EN IMPORTACIONES","PROCEDIMIENTO PROYECTO DE LEY ORDINARIO","2025-06-02","2029-06-02","2025-06-23","114","","2026-04-10T15:33:40.043913"
"584","25018","AUTORIZACIÓN AL INSTITUTO NACIONAL DE VIVIENDA Y URBANISMO (INVU) PARA LA DONACIÓN DE LOS TERRENOS DE LOS ASENTAMIENTOS LA COLINA, EL BAMBÚ, LIMONCITO Y LIRIOS","PROCEDIMIENTO PROYECTO DE LEY ORDINARIO","2025-05-29","2029-05-29","2025-06-20","113","","2026-04-10T15:33:40.043913"
"585","25017","REFORMA DE LA LEY 10.705, LEY PARA LA DINAMIZACIÓN DE LA ATENCIÓN DE LA POBLACIÓN VULNERABLE EN COSTA RICA, DE 26 DE MAYO DE 2025. ANTES DENOMINADO: MODIFICACION A LEY N.º 10.705 LEY PARA LA DINAMIZACIÓN DE LA ATENCIÓN DE LA POBLACIÓN VULNERABLE EN COSTA RICA","PROCEDIMIENTO PROYECTO DE LEY ORDINARIO","2025-05-29","2029-05-29","2025-06-20","113","","2026-04-10T15:33:40.043913"
"586","25016","ADICIÓN DE TRES PARRAFOS FINALES AL ARTÍCULO 1 DE LA LEY N°6280 DEL 25 DE OCTUBRE DE 1978, LEY DE CREACIÓN DEL PARQUE NACIONAL BRAULIO CARRILLO","PROCEDIMIENTO PROYECTO DE LEY ORDINARIO","2025-05-29","2029-05-29","2025-06-20","113","","2026-04-10T15:33:40.043913"
"587","25015","DONACIÓN DE UN TERRENO PROPIEDAD DEL BANCO DE COSTA RICA A LA MUNICIPALIDAD DEL CANTÓN DE NARANJO CON FINALIDAD DE CONSERVACIÓN DE LA BIODIVERSIDAD, LA INVESTIGACIÓN Y LA EDUCACIÓN AMBIENTAL","PROCEDIMIENTO PROYECTO DE LEY ORDINARIO","2025-05-29","2029-05-29","2025-06-13","108","","2026-04-10T15:33:40.043913"
"588","25014","LEY MARCO SOBRE CAPTURA Y COMERCIALIZACIÓN DE CARBONO AZUL EN ECOSISTEMAS MARINOS ELIZABETH ODIO BENITO","PROCEDIMIENTO PROYECTO DE LEY ORDINARIO","2025-05-29","2029-05-29","2025-06-13","108","","2026-04-10T15:33:40.043913"
"589","25013","PROTECCIÓN Y RESTAURACIÓN DE ARRECIFES CORALINOS ROCOSOS Y PASTOS MARINOS","PROCEDIMIENTO PROYECTO DE LEY ORDINARIO","2025-05-29","2029-05-29","2025-06-17","110","","2026-04-10T15:33:40.043913"
"590","25012","PREVENCIÓN DEL USO INDEBIDO DE COMBUSTIBLE DESTINADO A LA PESCA NO DEPORTIVA MEDIANTE LA DIGITALIZACIÓN DE LOS CONTROLES DE DISTRIBUCIÓN Y CONSUMO","PROCEDIMIENTO PROYECTO DE LEY ORDINARIO","2025-05-29","2029-05-29","2025-06-12","107","","2026-04-10T15:33:40.043913"
"591","25011","PERMISO DE ATRAQUE, DESEMBARQUE Y PERMANENCIA EN PUERTO DE LA TRIPULACIÓN DE LA FRAGATA A.R.A. LIBERTAD, BUQUE ESCUELA DE LA ARMADA ARGENTINA, NO ARTILLADO, QUE PERMANECERÁ EN EL PUERTO DE LIMÓN DURANTE EL PERÍODO COMPRENDIDO ENTRE EL 21 AL 24 DE SETIEMBRE DE 2025.","PROCEDIMIENTO SOLICITUDES DE ATRAQUE Y DESEMBARQUE","2025-05-28","2029-05-28","","","","2026-04-10T15:33:40.043913"
"592","25010","INVESTIGACIÓN SOBRE LA CAPACIDAD DEL PANI PARA GARANTIZAR DERECHOS DE LA NIÑEZ Y ADOLESCENCIA","PROCEDIMIENTO COMISIONES ESPECIALES INVESTIGADORAS","2025-05-27","2029-05-27","","","","2026-04-10T15:33:40.043913"
"593","25009","REFORMA AL ARTÍCULO 86 DEL REGLAMENTO INTERNO DE LA ASAMBLEA LEGISLATIVA","PROCEDIMIENTO REFORMAS AL REGLAMENTO DE LA ASAMBLEA LEGISLATIVA","2025-05-27","2029-05-27","2025-06-11","106","","2026-04-10T15:33:40.043913"
"595","25007","LEY PARA LA MODERNIZACIÓN DEL RÉGIMEN CAMBIARIO: DEROGATORIA DEL ARTÍCULO 97 DE LA LEY Nº7558, DEL 27 DE NOVIEMBRE DE 1995, LEY ORGÁNICA DEL BANCO CENTRAL DE COSTA RICA Y SUS REFORMAS","PROCEDIMIENTO PROYECTO DE LEY ORDINARIO","2025-05-26","2029-05-26","2025-06-11","106","","2026-04-10T15:33:40.043913"
"596","25006","LEVANTAMIENTO DE INMUNIDAD CONTRA EL SEÑOR ALEXANDER BARRANTES CHACÓN POR EL DELITO DE COHECHO IMPROPIO EN LA MODALIDAD DE PENALIDAD DEL CORRUPTOR.","PROCEDIMIENTO QUERELLAS DE LOS MIEMBROS DE LOS SUPREMOS PODERES","2025-05-26","2029-05-26","","","","2026-04-10T15:33:40.043913"
"597","25005","EVALUACIÓN E INVESTIGACIÓN DE LAS INVERSIONES Y EL IMPACTO DE LA IMPLEMENTACIÓN DEL SISTEMA LOGÍSTICO DE PEDIDOS EN EL PROGRAMA DE ABASTECIMIENTO INSTITUCIONAL DEL CONSEJO NACIONAL DE PRODUCCIÓN (CNP) POR PARTE DE RADIOGRÁFICA COSTARRICENSE (RACSA).","PROCEDIMIENTO COMISIONES ESPECIALES INVESTIGADORAS","2025-05-26","2029-05-26","","","","2026-04-10T15:33:40.043913"
"598","25004","INVESTIGACION: PARA ""INVESTIGAR TODO LO RELACIONADO CON LOS DESPIDOS MASIVOS EN EL INSTITUTO NACIONAL DE SEGUROS, ASÍ COMO PARA DETERMINAR SI LA CONDUCTA DESPLEGADA POR LAS AUTORIDADES INSTITUCIONALES EN ESTE ÁMBITO RESPONDE ADECUADAMENTE AL CUMPLIMIENTO DE LOS FINES PÚBLICOS INSTITUCIONALES, ENTRE LOS QUE SE ENCUENTRAN EL CUMPLIMIENTO DE LOS FINES SOCIALES PARA LOS QUE LA INSTITUCIÓN FUE CREADA, GARANTIZANDO LA ADECUADA UTILIZACION DE LOS RECURSOS PÚBLICOS"".","PROCEDIMIENTO COMISIONES ESPECIALES INVESTIGADORAS","2025-05-26","2029-05-26","","","","2026-04-10T15:33:40.043913"
"599","25003","REFORMA DE LA LEY DE PROTECCIÓN AL TRABAJADOR, N.º 7983, DE 16 DE FEBRERO DE 2000, Y SUS REFORMAS","PROCEDIMIENTO PROYECTO DE LEY ORDINARIO","2025-05-22","2029-05-22","2025-06-11","106","","2026-04-10T15:33:40.043913"
"600","25002","LEY PARA ESTABLECER LA LICENCIA Y SUBSIDIO PARA PERSONAS TRABAJADORAS INDEPENDIENTES RESPONSABLES DE PACIENTES EN FASE TERMINAL Y PERSONAS MENORES DE EDAD GRAVEMENTE ENFERMAS. REFORMA A LOS ARTÍCULOS 1, 5, 6 Y 9 DE LA LEY BENEFICIOS PARA LOS RESPONSABLES DE PACIENTES EN FASE TERMINAL Y PERSONAS MENORES DE EDAD GRAVEMENTE ENFERMAS, LEY N.°7756","PROCEDIMIENTO PROYECTO DE LEY ORDINARIO","2025-05-22","2029-05-22","2025-06-06","103","","2026-04-10T15:33:40.043913"
"601","25001","REFORMA DEL ARTÍCULO 128 DEL REGLAMENTO DE LA ASAMBLEA LEGISLATIVA PARA QUE SE ESTABLEZCA PLAZO PARA LA ENTREGA DE INFORMES DE LAS SUBCOMISIONES","PROCEDIMIENTO REFORMAS AL REGLAMENTO DE LA ASAMBLEA LEGISLATIVA","2025-05-22","2029-05-22","2025-06-06","103","","2026-04-10T15:33:40.043913"
"602","25000","REFORMA DEL INCISO F) DEL ARTÍCULO 8 Y DEROGATORIA DEL INCISO F) DEL ARTÍCULO 9 DE LA LEY DE IMPUESTO SOBRE LA RENTA, N.º 7092 DE 21 DE ABRIL DE 1988, Y SUS REFORMAS","PROCEDIMIENTO PROYECTO DE LEY ORDINARIO","2025-05-22","2029-05-22","2025-06-05","102","","2026-04-10T15:33:40.043913"
"603","24999","AUTORIZACION A LA JUNTA DE EDUCACIÓN DE LA ESCUELA LAJAS DE CAÑAS, PARA SEGREGAR UN TERRENO Y DONARLO A LA CAJA COSTARICENSE DE SEGURO SOCIAL","PROCEDIMIENTO PROYECTO DE LEY ORDINARIO","2025-05-22","2029-05-22","2025-06-05","102","","2026-04-10T15:33:40.043913"
"604","24998","APROBACIÓN DEL ACUERDO DE TRANSPORTE AÉREO ENTRE EL GOBIERNO DE LA REPÚBLICA DE COSTA RICA Y EL GOBIERNO DE LA REPÚBLICA DE CHILE","PROCEDIMIENTO PROYECTO DE LEY ORDINARIO","2025-05-22","2029-05-22","2025-06-06","103","","2026-04-10T15:33:40.043913"
"605","24997","LEY PARA LA CREACIÓN DE OPORTUNIDADES DE EMPLEABILIDAD, EDUCACIÓN Y CAPACITACIÓN PARA MUJERES VINCULADAS A UN PROCESO PENAL Y SUS FAMILIARES DEPENDIENTES","PROCEDIMIENTO PROYECTO DE LEY ORDINARIO","2025-05-22","2029-05-22","2025-06-06","103","","2026-04-10T15:33:40.043913"
"606","24996","REFORMA A LOS ARTÍCULOS 5 Y 7, Y ADICIÓN DE UN TRANSITORIO V A LA LEY N.° 9428 IMPUESTO A LAS PERSONAS JURÍDICAS DE 21 DE MARZO DE 2017 Y SUS REFORMAS","PROCEDIMIENTO PROYECTO DE LEY ORDINARIO","2025-05-21","2029-05-21","2025-06-11","106","","2026-04-10T15:33:40.043913"
"607","24995","REFORMA A LA LEY N.º 8683, ""LEY DE IMPUESTO SOLIDARIO PARA EL FORTALECIMIENTO DE PROGRAMAS DE VIVIENDA"", PARA FORTALECER LA GESTIÓN LOCAL EN MATERIA DE MEJORAMIENTO HABITACIONAL","PROCEDIMIENTO PROYECTO DE LEY ORDINARIO","2025-05-21","2029-05-21","2025-06-06","103","","2026-04-10T15:33:40.043913"
"608","24994","REFORMA AL ARTÍCULO 105 DE LA LEY N°4755, CÓDIGO DE NORMAS Y PROCEDIMIENTOS TRIBUTARIOS DEL 3 DE MAYO DE 1971 Y SUS REFORMAS, LEY DE PROTECCIÓN CONTRA LA VORACIDAD INFORMATIVA","PROCEDIMIENTO PROYECTO DE LEY ORDINARIO","2025-05-21","2029-05-21","2025-05-30","98","","2026-04-10T15:33:40.043913"
"609","24993","LEY DE CIERRE DEL CONSEJO DE TRANSPORTE PÚBLICO","PROCEDIMIENTO PROYECTO DE LEY ORDINARIO","2025-05-21","2029-05-21","2025-06-03","100","","2026-04-10T15:33:40.043913"
"610","24992","PRIMER PRESUPUESTO EXTRAORDINARIO DE LA REPÚBLICA PARA EL EJERCICIO ECONÓMICO 2025 Y PRIMERA MODIFICACIÓN LEGISLATIVA DE LA LEY N° 10.620, LEY DE PRESUPUESTO ORDINARIO Y EXTRAORDINARIO DE LA REPÚBLICA PARA EL EJERCICIO ECONÓMICO 2025, DEL 6 DE DICIEMBRE DE 2024.","PROCEDIMIENTO PRESUPUESTOS (ORDINARIOS, EXTRAORDINARIOS Y MODIFICACIONES)","2025-05-20","2029-05-20","2025-06-06","103","SI","2026-04-10T15:33:40.043913"
"611","24991","LIQUIDACIÓN DE PRESUPUESTOS PÚBLICOS Y DICTAMEN DE LA CONTRALORÍA GENERAL DE LA REPÚBLICA DEL 2024 (COMISIÓN PERMANENTE DE ASUNTOS HACENDARIOS)","PROCEDIMIENTO COMISIONES AD-HOC","2025-05-20","2029-05-20","","","","2026-04-10T15:33:40.043913"
"612","24990","LEY ESPECIAL PARA EL RECLUTAMIENTO Y LA SELECCIÓN DE LA PERSONA EN CONDICIÓN DE DISCAPACIDAD EN EL SECTOR PÚBLICO","PROCEDIMIENTO PROYECTO DE LEY ORDINARIO","2025-05-19","2029-05-19","2025-06-06","103","","2026-04-10T15:33:40.043913"
"613","24989","LEY ESPECIAL PARA LA PROMOCIÓN DE ALIANZAS PÚBLICO-PRIVADAS EN BENEFICIO DE LAS PERSONAS EN CONDICIÓN DE DISCAPACIDAD","PROCEDIMIENTO PROYECTO DE LEY ORDINARIO","2025-05-19","2029-05-19","2025-06-06","103","","2026-04-10T15:33:40.043913"
"614","24988","LEY ESPECIAL PARA LA INCORPORACIÓN DE PERSONAS EN CONDICIÓN DE DISCAPACIDAD EN COLEGIOS PROFESIONALES CON SEDE EN COSTA RICA","PROCEDIMIENTO PROYECTO DE LEY ORDINARIO","2025-05-19","2029-05-19","2025-06-05","102","","2026-04-10T15:33:40.043913"
"615","24987","LEY ESPECIAL PARA LA PROMOCIÓN DE TECNOLOGÍA ASISTIVA PARA LA PERSONA EN CONDICIÓN DE DISCAPACIDAD","PROCEDIMIENTO PROYECTO DE LEY ORDINARIO","2025-05-19","2029-05-19","2025-05-26","94","","2026-04-10T15:33:40.043913"
"616","24986","LEY DE MODERNIZACIÓN DEL SISTEMA DE INMOVILIZACIÓN Y RETIRO DE PLACAS EN MATERIA DE TRÁNSITO","PROCEDIMIENTO PROYECTO DE LEY ORDINARIO","2025-05-19","2029-05-19","2025-05-26","94","","2026-04-10T15:33:40.043913"
"617","24985","REFORMA AL ARTÍCULO 572 DEL CÓDIGO CIVIL: INCLUSIÓN DE LOS NIETOS Y LAS NIETAS EN LA PRELACIÓN SUCESORIA Y MODERNIZACIÓN TERMINOLÓGICA","PROCEDIMIENTO PROYECTO DE LEY ORDINARIO","2025-05-19","2029-05-19","2025-05-26","94","","2026-04-10T15:33:40.043913"
"618","24984","REFORMA DE LOS ARTÍCULOS 20, 22, 23 Y 43; ADICIÓN DE UN PÁRRAFO FINAL AL ARTÍCULO 49 Y DOS TRANSITORIOS NUEVOS, Y DEROGATORIA DE LOS ARTÍCULOS 24 Y 25, TODOS DE LA LEY DE PROTECCIÓN AL TRABAJADOR, LEY 7983 DEL 16 DE FEBRERO DEL 2000; Y REFORMA DEL ARTÍCULO 60 DE LA LEY CONSTITUTIVA DE LA CAJA COSTARRICENSE DEL SEGURO SOCIAL, LEY 17 DEL 22 DE OCTUBRE DE 1943, PARA LA ADECUADA INTERPRETACIÓN, APLICACIÓN Y GESTIÓN DEVOLUTIVA DE LOS RECURSOS DEL RÉGIMEN OBLIGATORIO DE PENSIONES COMPLEMENTARIAS (ROPC) CREADO PARA COMPLEMENTAR LOS BENEFICIOS ESTABLECIDOS POR LOS REGÍMENES DE PENSIONES: IVM-CCSS Y LOS ESPECIALES SUSTITUTOS. ANTES DENOMINADO: REFORMA DE LOS ARTÍCULOS 1, 9, 20, 22, 23 Y 43; ADICIÓN DE UN PÁRRAFO FINAL AL ARTÍCULO 49 Y DOS TRANSITORIOS NUEVOS; Y DEROGATORIA DE LOS ARTÍCULOS 24 Y 25, TODOS DE LA LEY DE PROTECCIÓN AL TRABAJADOR, LEY 7983 DEL 16 DE FEBRERO DEL 2000, PARA LA ADECUADA INTERPRETACIÓN Y APLICACIÓN DE LOS RECURSOS DEL RÉGIMEN OBLIGATORIO DE PENSIONES COMPLEMENTARIAS (ROP) CREADO PARA COMPLEMENTAR LOS BENEFICIOS ESTABLECIDOS POR EL RÉGIMEN DE INVALIDEZ VEJEZ Y MUERTE DE LA CCSS","PROCEDIMIENTO PROYECTO DE LEY ORDINARIO","2025-05-16","2029-05-16","2025-05-26","94","","2026-04-10T15:33:40.043913"
"649","24953","DECLARATORIA DE INTERÉS PÚBLICO Y CULTURAL DE LA VUELTA CICLISTA A COSTA RICA","PROCEDIMIENTO PROYECTO DE LEY ORDINARIO","2025-04-24","2029-04-24","2025-05-06","80","","2026-04-10T15:33:40.043913"
"619","24983","LEY QUE AUTORIZA AL INSTITUTO DE DESARROLLO RURAL (INDER) A ESTABLECER CONVENIOS DE COOPERACIÓN CON LA MUNICIPALIDAD DE BUENOS AIRES EN LA EJECUCIÓN DE PROYECTOS DE INFRAESTRUCTURA VIAL PARA EL DESARROLLO RURAL (ANTERIORMEMNTE DENOMINADO) LEY QUE AUTORIZA AL INSTITUTO DE DESARROLLO RURAL (INDER) PARA TRANSFERIR A LA MUNICIPALIDAD DE BUENOS AIRES LOS FONDOS CONSIGNADOS JUDICIALMENTE POR CONCEPTO DE ARRENDAMIENTO DE FINCAS A LA EMPRESA PINDECO S.A.","PROCEDIMIENTO PROYECTO DE LEY ORDINARIO","2025-05-15","2029-05-15","2025-05-26","94","","2026-04-10T15:33:40.043913"
"620","24982","LEY PARA GARANTIZAR EL SEGURO VEHICULAR DE RESPONSABILIDAD CIVIL CONTRA DAÑOS A LA PROPIEDAD DE TERCEROS","PROCEDIMIENTO PROYECTO DE LEY ORDINARIO","2025-05-15","2029-05-15","2025-05-26","94","","2026-04-10T15:33:40.043913"
"621","24981","FISCALIZACIÓN DE LA CALIDAD DE LA INFRAESTRUCTURA AEROPORTUARIA","PROCEDIMIENTO PROYECTO DE LEY ORDINARIO","2025-05-15","2029-05-15","2025-05-26","94","","2026-04-10T15:33:40.043913"
"622","24980","REFORMA AL ARTÍCULO 101 DEL CÓDIGO DE FAMILIA, LEY 5476, PARA REGULAR EL DERECHO DE PERMANECER CON LA FAMILIA CONSANGUÍNEA","PROCEDIMIENTO PROYECTO DE LEY ORDINARIO","2025-05-15","2029-05-15","2025-05-30","98","","2026-04-10T15:33:40.043913"
"623","24979","LEY PARA IMPULSAR LA PARTICIPACIÓN DE LAS JUVENTUDES EN EMPRENDIMIENTOS TECNOLÓGICOS E INNOVADORES EN COSTA RICA","PROCEDIMIENTO PROYECTO DE LEY ORDINARIO","2025-05-15","2029-05-15","2025-05-26","94","","2026-04-10T15:33:40.043913"
"624","24978","LEY PARA AUTORIZAR AL ESTADO Y A CUALQUIER INSTITUCIÓN PÚBLICA A COLABORAR Y REALIZAR DONACIONES FAVOR DE LA FUNDACIÓN PRO-MUNDO - ""CHEPE SE BAÑA""","PROCEDIMIENTO PROYECTO DE LEY ORDINARIO","2025-05-14","2029-05-14","2025-05-26","94","","2026-04-10T15:33:40.043913"
"625","24977","INVESTIGACION EN RELACIÓN CON LOS PLANES REGULADORES COSTEROS","PROCEDIMIENTO COMISIONES ESPECIALES INVESTIGADORAS","2025-05-14","2029-05-14","","","","2026-04-10T15:33:40.043913"
"626","24976","REFORMA AL ARTÍCULO 25 DE LA LEY N. º 3503, LEY REGULADORA TRANSPORTE REMUNERADO PERSONAS VEHÍCULOS AUTOMOTORES","PROCEDIMIENTO PROYECTO DE LEY ORDINARIO","2025-05-13","2029-05-13","2025-05-20","90","","2026-04-10T15:33:40.043913"
"627","24975","LEY PARA REGULAR LOS PERMISOS DE USO PARA ACTIVIDADES DE INVESTIGACIÓN, CAPACITACIÓN Y ECOTURISMO EN EL PATRIMONIO NATURAL DEL ESTADO","PROCEDIMIENTO PROYECTO DE LEY ORDINARIO","2025-05-13","2029-05-13","2025-05-20","90","","2026-04-10T15:33:40.043913"
"628","24974","REFORMA AL REGLAMENTO DE LA ASAMBLEA LEGISLATIVA PARA GARANTIZAR LA TRANSPARENCIA, LA IDONEIDAD Y LA IGUALDAD EN LOS NOMBRAMIENTOS ADMINISTRATIVOS","PROCEDIMIENTO REFORMAS AL REGLAMENTO DE LA ASAMBLEA LEGISLATIVA","2025-05-12","2029-05-12","2025-05-30","98","","2026-04-10T15:33:40.043913"
"629","24973","LEY REGULADORA DEL DERECHO FUNDAMENTAL A LA PARTICIPACIÓN CIUDADANA","PROCEDIMIENTO PROYECTO DE LEY ORDINARIO","2025-05-12","2029-05-12","2025-05-20","90","","2026-04-10T15:33:40.043913"
"630","24972","MODIFICACIÓN DEL TRANSITORIO XX DE LA LEY DE PROTECCIÓN AL TRABAJADOR, LEY N.°7983, DEL 16 DE FEBRERO DE 2000 Y SUS REFORMAS. LEY PARA LA DEVOLUCIÓN DEL ROP A LAS PERSONAS PENSIONADAS ENTRE EL 1 DE ENERO DE 2021 Y EL 31 DICIEMBRE DEL 2029","PROCEDIMIENTO PROYECTO DE LEY ORDINARIO","2025-05-12","2029-05-12","2025-06-05","102","","2026-04-10T15:33:40.043913"
"631","24971","REFORMA DEL ARTÍCULO 2 DE LA LEY ORGÁNICA DEL BANCO CENTRAL DE COSTA RICA, LEY NO. 7558 DEL 3 DE NOVIEMBRE DE 1995, LEY PARA MODIFICAR EL OBJETIVO CENTRAL DEL BCCR Y SUBSIDIARIO","PROCEDIMIENTO PROYECTO DE LEY ORDINARIO","2025-05-12","2029-05-12","2025-05-20","90","","2026-04-10T15:33:40.043913"
"632","24970","REFORMA AL ARTÍCULO 1 DE LA LEY FORESTAL, LEY N°7575, DE 16 DE ABRIL DE 1996","PROCEDIMIENTO PROYECTO DE LEY ORDINARIO","2025-05-08","2029-05-08","2025-05-20","90","","2026-04-10T15:33:40.043913"
"633","24969","REFORMA DE VARIOS ARTÍCULOS DE LA LEY 2726, LEY CONSTITUTIVA DEL INSTITUTO COSTARRICENSE DE ACUEDUCTOS Y ALCANTARILLADOS, DEL 14 DE ABRIL DE 1961, Y SUS REFORMAS","PROCEDIMIENTO PROYECTO DE LEY ORDINARIO","2025-05-08","2029-05-08","2025-05-20","90","","2026-04-10T15:33:40.043913"
"634","24968","DESAFECTACIÓN DEL USO PÚBLICO Y AUTORIZACIÓN PARA QUE SE SEGREGUE Y DONE UN TERRENO PROPIEDAD DEL MINISTERIO DE GOBERNACIÓN A LA ASOCIACIÓN DE DESARROLLO INTEGRAL DE SAN PABLO DE PLATANARES DE PÉREZ ZELEDÓN, SAN JOSÉ","PROCEDIMIENTO PROYECTO DE LEY ORDINARIO","2025-05-08","2029-05-08","2025-05-20","90","","2026-04-10T15:33:40.043913"
"635","24967","LEY PARA LA ATENCIÓN TEMPRANA EN PRIMERA INFANCIA","PROCEDIMIENTO PROYECTO DE LEY ORDINARIO","2025-05-07","2029-05-07","2025-05-16","88","","2026-04-10T15:33:40.043913"
"636","24966","LEY DE LA DIGNIDAD EN EL EJERCICIO POLICIAL, MODIFICACIÓN Y ADICIÓN A LA LEY N°7410, LEY GENERAL DE POLICÍA DEL 26 MAYO DE 1994","PROCEDIMIENTO PROYECTO DE LEY ORDINARIO","2025-05-06","2029-05-06","2025-05-26","94","","2026-04-10T15:33:40.043913"
"637","24965","REFORMA DE LOS ARTÍCULOS 105, 136, 138, 140, 143, 145, 177, 284, 301, 310 Y ADICIÓN DE UN ARTÍCULO 136 BIS AL CÓDIGO DE TRABAJO, LEY N°2 DEL 27 DE AGOSTO DE 1943, Y REFORMA DEL INCISO D) DEL ARTÍCULO 2, ADICIÓN DE UN INCISO F) Y REFORMA DEL ARTÍCULO 15 DE LA LEY QUE CREA LA RED NACIONAL DE CUIDO Y DESARROLLO INFANTIL, LEY N° 9220 DEL 24 DE MARZO DEL 2014. LEY PARA LA MODERNIZACIÓN DE LA JORNADA ORDINARIA","PROCEDIMIENTO PROYECTO DE LEY ORDINARIO","2025-05-01","2029-05-01","2025-05-13","85","","2026-04-10T15:33:40.043913"
"638","24964","DECLARATORIA DE LAS FIESTAS CÍVICAS DE LIBERIA COMO PATRIMONIO CULTURAL INMATERIAL DE COSTA RICA Y DECLARATORIA DE LOS ESTILOS DE MONTAS GUAPE, ALMUERCEADA, EN ALBARDA, RÚSTICA Y CARA PA TRAS DESDE BRAMADERO, CON MOTIVO DE LA CELEBRACIÓN DE LAS FIESTAS CÍVICAS DE LIBERIA COMO PATRIMONIO CULTURAL INMATERIAL DE COSTA RICA.","PROCEDIMIENTO PROYECTO DE LEY ORDINARIO","2025-05-01","2029-05-01","2025-05-13","85","","2026-04-10T15:33:40.043913"
"639","24963","NUEVA LEY ORGANICA DEL COLEGIO DE CONTADORES PRIVADOS DE COSTA RICA Y DEROGATORIA DE LA LEY 1269","PROCEDIMIENTO PROYECTO DE LEY ORDINARIO","2025-04-30","2029-04-30","2025-05-13","85","","2026-04-10T15:33:40.043913"
"640","24962","LEY PARA QUE EL ESTADO ASUMA EL PAGO DE PENSIONES ALIMENTARIAS EN FAVOR DE PERSONAS MENORES DE EDAD, CUANDO RESULTE IMPOSIBLE EL COBRO A DEUDORES MAYORES DE 65 AÑOS","PROCEDIMIENTO PROYECTO DE LEY ORDINARIO","2025-04-30","2029-04-30","2025-05-20","90","","2026-04-10T15:33:40.043913"
"641","24961","LEY PARA LA RESTITUCIÓN DEL DERECHO A LA HUELGA Y A LA PROTESTA, POR LA DEFENSA DE LA LIBERTAD, LA DEMOCRACIA Y LOS DERECHOS LABORALES EN COSTA RICA","PROCEDIMIENTO PROYECTO DE LEY ORDINARIO","2025-04-30","2029-04-30","2025-05-13","85","","2026-04-10T15:33:40.043913"
"642","24960","LEY PARA DECLARAR DELITO LA UTILIZACIÓN DE PERSONAS MENORES DE EDAD A LA MENDICIDAD","PROCEDIMIENTO PROYECTO DE LEY ORDINARIO","2025-04-29","2029-04-29","2025-05-16","88","","2026-04-10T15:33:40.043913"
"643","24959","LEY REGULADORA DE LA HIPOTECA INVERSA","PROCEDIMIENTO PROYECTO DE LEY ORDINARIO","2025-04-29","2029-04-29","2025-05-16","88","","2026-04-10T15:33:40.043913"
"644","24958","LEY PARA LA REGULACIÓN DEL PLANIFICADOR FINANCIERO CON FE PÚBLICA Y EL FORTALECIMIENTO DE LA GESTIÓN FINANCIERA EN COSTA RICA","PROCEDIMIENTO PROYECTO DE LEY ORDINARIO","2025-04-28","2029-04-28","2025-05-26","94","","2026-04-10T15:33:40.043913"
"645","24957","LEY MARCO DE SEGUROS AGROPECUARIOS","PROCEDIMIENTO PROYECTO DE LEY ORDINARIO","2025-04-28","2029-04-28","2025-05-13","85","","2026-04-10T15:33:40.043913"
"646","24956","REFORMA DEL INCISO A) DEL ARTÍCULO 13 DEL CÓDIGO MUNICIPAL,LEY N°7794 DEL 30 DE ABRIL DE 1998. LEY PARA PROMOVER LOS DERECHOS HUMANOS DE LAS MUJERES A TRAVÉS LAS OFICINAS MUNICIPALES DE LA MUJER, ANTERIORMENTE LLAMADO LEY PARA EL FORTALECIMIENTO DE LAS OFICINAS MUNICIPALES DE LA MUJER (OFIM)","PROCEDIMIENTO PROYECTO DE LEY ORDINARIO","2025-04-28","2029-04-28","2025-05-13","85","","2026-04-10T15:33:40.043913"
"647","24955","LEY PARA LA PROTECCIÓN DEL DERECHO DE RETIRO DEL RÉGIMEN OBLIGATORIO DE PENSIONES COMPLEMENTARIAS (ROPC) AL ALCANZAR LA EDAD DE JUBILACIÓN","PROCEDIMIENTO PROYECTO DE LEY ORDINARIO","2025-04-25","2029-04-25","2025-05-06","80","","2026-04-10T15:33:40.043913"
"648","24954","LEY DECLARATORIA DE INTERÉS PÚBLICO DEL DESARROLLO TURÍSTICO DE LOS CANTONES DE NARANJO Y ZARCERO","PROCEDIMIENTO PROYECTO DE LEY ORDINARIO","2025-04-24","2029-04-24","2025-05-06","80","","2026-04-10T15:33:40.043913"
"650","24952","DIA NACIONAL DEL HUNDIMIENTO DEL BARCO MERCANTE SAN PABLO","PROCEDIMIENTO PROYECTO DE LEY ORDINARIO","2025-04-24","2029-04-24","2025-05-13","85","","2026-04-10T15:33:40.043913"
"651","24951","REFORMA A LOS ARTÍCULOS 239, 239 BIS Y 244 DEL CÓDIGO PENAL, LEY Nº7594 DEL 10 DE ABRIL DE 1996 Y SUS REFORMAS LEY PARA AMPLIAR LOS SUPUESTOS DE APLICACIÓN DE LA PRISIÓN PREVENTIVA CON EL FIN DE REDUCIR Y CONTROLAR LA DELINCUENCIA","PROCEDIMIENTO PROYECTO DE LEY ORDINARIO","2025-04-24","2029-04-24","2025-05-06","80","","2026-04-10T15:33:40.043913"
"652","24950","ADICION DE UN ARTÍCULO 23 BIS A LA LEY GENERAL DE LA ADMINISTRACIÓN PÚBLICA LEY NO6227 PARA FORTALECER LAS ACCIONES TECNICAS Y LA IDONEIDAD EN LOS MINISTERIOS","PROCEDIMIENTO PROYECTO DE LEY ORDINARIO","2025-04-24","2029-04-24","2025-05-06","80","","2026-04-10T15:33:40.043913"
